input,output
"Outline the workflow for implementing a customer feedback loop in product development.","Collect feedback through surveys, interviews, and user testing, analyze and categorize feedback to identify common themes and issues, prioritize feedback based on impact and feasibility, integrate feedback into the product roadmap, communicate changes and updates to customers, implement the changes in the development cycle, test and validate the updates, release the improved product, and continue to gather and iterate based on ongoing customer feedback."
"Explain the process of setting up an enterprise data warehouse for business intelligence.","Define business intelligence requirements and objectives, design the data warehouse architecture, select appropriate data warehousing technologies, extract data from various sources, transform and clean the data, load data into the warehouse (ETL process), implement data modeling and schema design, set up indexing and optimization for query performance, integrate with BI tools for reporting and analysis, and maintain and update the data warehouse as needed."
"Detail the workflow for managing a multi-phase marketing campaign.","Plan the campaign by defining goals, target audience, and key messages, develop creative assets and content, set up marketing channels and distribution strategies, schedule the campaign phases with specific timelines, launch the initial phase and monitor performance, adjust tactics based on real-time data, execute subsequent phases with refinements, analyze overall campaign effectiveness, and compile a report with insights and lessons learned."
"Describe the steps to implement a green IT initiative in an organization.","Assess the current IT infrastructure and energy usage, set sustainability goals, adopt energy-efficient hardware and virtualization technologies, implement power management practices, promote digital sustainability through paperless processes, optimize data center operations for energy efficiency, educate employees on green practices, track and report on sustainability metrics, and continuously seek opportunities to reduce the environmental impact of IT operations."
"Outline the workflow for developing a custom enterprise software solution.","Gather and document business requirements through stakeholder interviews, design the software architecture and system specifications, create wireframes and prototypes, develop the software using appropriate programming languages and frameworks, conduct iterative testing and quality assurance, gather feedback from stakeholders, refine and enhance features based on feedback, deploy the software in the enterprise environment, provide training and support to users, and maintain and update the software as needed."
"Explain the process of setting up a remote monitoring and alerting system for IT infrastructure.","Identify critical systems and metrics to monitor, select appropriate monitoring tools (e.g., Nagios, Zabbix), configure monitoring agents on servers and devices, set up dashboards for real-time visibility, define alert thresholds and notification channels, implement automated responses for certain alerts, test the monitoring and alerting setup, train the IT team on using the system, and continuously refine monitoring parameters based on system performance and incidents."
"Detail the workflow for managing a cross-border logistics operation.","Plan the logistics strategy considering international regulations and customs, select reliable shipping partners and carriers, manage documentation for imports and exports, coordinate transportation modes (air, sea, land), track shipments in real-time, handle customs clearance and duties, ensure compliance with international trade laws, optimize routes for cost and time efficiency, communicate with stakeholders, and address any issues or delays promptly to ensure timely delivery."
"Describe the steps to implement a zero-trust security model in an organization.","Assess the current security posture and identify critical assets, define zero-trust policies and access controls, implement strong authentication mechanisms (e.g., multi-factor authentication), segment the network to limit access, continuously monitor and validate user and device activities, enforce least privilege principles, integrate security tools for threat detection and response, train employees on zero-trust principles, and regularly review and update security policies to adapt to evolving threats."
"Outline the workflow for conducting a comprehensive environmental impact assessment for a new project.","Define the scope and objectives of the assessment, gather baseline environmental data, identify potential environmental impacts of the project, evaluate the significance of each impact, propose mitigation measures to minimize negative effects, engage stakeholders and gather public input, compile the assessment report, review and approve the findings, implement mitigation strategies during project execution, and monitor environmental performance throughout the project lifecycle."
"Explain the process of setting up an enterprise-wide communication strategy.","Assess current communication channels and effectiveness, define communication goals aligned with business objectives, identify target audiences, develop key messages and content, select appropriate communication platforms (e.g., intranet, newsletters, meetings), establish a communication schedule, implement feedback mechanisms, train employees on communication best practices, monitor communication effectiveness through metrics and surveys, and adjust the strategy based on feedback and changing needs."
"Detail the workflow for managing a research and development (R&D) project in a tech company.","Define the R&D objectives and scope, assemble a multidisciplinary team, conduct literature reviews and market research, brainstorm and conceptualize ideas, develop prototypes or proofs of concept, test and validate the prototypes, iterate based on test results, secure intellectual property if applicable, plan for scaling the successful innovations, collaborate with other departments for product integration, and evaluate the project outcomes against the initial goals."
"Describe the steps to implement an employee performance management system.","Define performance metrics and objectives aligned with business goals, select a performance management software or framework, communicate the system to employees, train managers and staff on using the system, set up regular performance review cycles, collect and provide continuous feedback, conduct formal performance appraisals, identify development needs and opportunities, recognize and reward high performers, and use performance data to inform HR decisions and organizational improvements."
"Outline the workflow for executing a public relations (PR) crisis management plan.","Identify the crisis and gather facts, assemble the crisis management team, assess the impact and potential responses, develop key messages and communication strategies, communicate transparently with stakeholders and the public, manage media relations by providing timely updates, monitor public sentiment and media coverage, adjust strategies as the situation evolves, mitigate damage to the organization’s reputation, and conduct a post-crisis review to learn and improve future responses."
"Explain the process of setting up a robust version control system for a development team.","Choose an appropriate version control system (e.g., Git), establish repository structures and branching strategies, define commit and merge policies, set up access controls and permissions, integrate with development tools and IDEs, implement workflows for feature development, code reviews, and releases, provide training for the team on best practices, monitor repository activity, and ensure regular backups and maintenance of the version control system."
"Detail the workflow for managing an online advertising campaign using programmatic advertising.","Define campaign objectives and target audience, set up programmatic advertising platforms and accounts, create and upload ad creatives, configure targeting parameters (e.g., demographics, behavior, context), set bid strategies and budgets, launch the campaign, monitor real-time performance metrics, optimize bidding and targeting based on data insights, manage ad placements to ensure brand safety, and analyze campaign results to measure ROI and effectiveness."
"Describe the steps to implement an agile data science workflow.","Define the data science project goals and requirements, gather and preprocess data, perform exploratory data analysis, develop and iterate on models using agile sprints, conduct peer reviews and testing, integrate models into production environments, deploy models using CI/CD practices, monitor model performance and accuracy, gather feedback from stakeholders, and continuously refine models based on new data and insights."
"Outline the workflow for establishing a corporate social responsibility (CSR) program.","Define the CSR objectives aligned with the company’s values, identify key focus areas (e.g., sustainability, community engagement), develop initiatives and projects, allocate resources and budget, engage stakeholders and partners, implement CSR activities, promote the program internally and externally, monitor and measure the impact of CSR efforts, report on CSR performance, and continuously improve the program based on feedback and changing societal needs."
"Explain the process of conducting a comprehensive competitor benchmarking analysis.","Identify key competitors in the market, select benchmarking criteria (e.g., product features, pricing, customer service), collect data on competitors’ performance and offerings, analyze strengths and weaknesses relative to your own business, identify best practices and areas for improvement, develop action plans to enhance competitiveness, implement changes based on insights, and regularly update the benchmarking analysis to stay informed about market dynamics."
"Detail the workflow for managing a high-availability (HA) system setup.","Assess system requirements for availability and reliability, design the HA architecture with redundancy and failover mechanisms, select appropriate hardware and software solutions, configure load balancing and clustering, implement data replication and backup strategies, set up monitoring and alerting systems, conduct failover testing to ensure resilience, deploy the HA system in production, continuously monitor performance and availability, and perform regular maintenance and updates to sustain high availability."
"Describe the steps to implement a data privacy compliance program in accordance with GDPR.","Conduct a data audit to map data flows and processing activities, appoint a data protection officer (DPO), develop and document data privacy policies, implement data protection measures (e.g., encryption, access controls), establish procedures for data subject rights (e.g., access, deletion requests), ensure third-party compliance, provide training and awareness programs for employees, set up mechanisms for data breach detection and reporting, and regularly review and update the compliance program to adhere to GDPR requirements."
"Outline the workflow for creating a comprehensive content strategy for a digital platform.","Define the platform’s goals and target audience, conduct content audits and gap analysis, develop content themes and topics aligned with audience interests, create a content calendar with publishing schedules, produce high-quality and engaging content in various formats (e.g., articles, videos, infographics), distribute content through appropriate channels, promote content via SEO and social media, measure content performance using analytics tools, and iterate the strategy based on performance data and audience feedback."
"Explain the process of setting up a scalable microservices infrastructure using Kubernetes.","Design the microservices architecture with clear service boundaries, containerize each microservice using Docker, set up a Kubernetes cluster, deploy microservices to the cluster with appropriate configurations, implement service discovery and load balancing, manage storage and stateful services, configure scaling policies based on demand, set up monitoring and logging using tools like Prometheus and Grafana, ensure security through network policies and role-based access control (RBAC), and continuously manage and optimize the infrastructure for scalability and reliability."
"Detail the workflow for managing a cross-platform mobile app development project.","Define project requirements and target platforms (iOS, Android), choose a cross-platform development framework (e.g., Flutter, React Native), design the app’s UI/UX, develop the app with shared codebase, implement platform-specific features as needed, conduct thorough testing on all target platforms, perform code reviews and optimize performance, prepare for app store submissions by adhering to guidelines, deploy the app to respective app stores, and manage updates and maintenance across platforms."
"Describe the steps to implement an enterprise-wide search engine optimization (SEO) initiative.","Conduct comprehensive keyword research across all business units, perform technical SEO audits for the entire website, optimize on-page elements (titles, meta descriptions, headers) for relevant keywords, improve site architecture and internal linking, create high-quality content aligned with SEO strategies, build authoritative backlinks, ensure mobile-friendliness and fast page load times, implement structured data and schema markup, monitor SEO performance with analytics tools, and coordinate efforts across departments to maintain consistent SEO practices."
"Outline the workflow for developing an integrated marketing communications (IMC) plan.","Define the marketing and communication objectives, identify the target audience segments, develop key messaging and value propositions, select appropriate communication channels (e.g., advertising, PR, digital marketing), create a unified content strategy, allocate budget and resources across channels, implement the communication tactics, coordinate timing and delivery of messages, monitor and measure campaign performance, and adjust the IMC plan based on feedback and results."
"Explain the process of setting up a real-time data analytics dashboard for a business.","Identify key performance indicators (KPIs) and metrics to monitor, select a data visualization tool (e.g., Tableau, Power BI), integrate data sources and set up data pipelines for real-time data ingestion, design the dashboard layout with clear and actionable visualizations, configure data refresh intervals, implement user access controls, test the dashboard for accuracy and usability, deploy the dashboard to stakeholders, provide training on interpreting the data, and continuously update and enhance the dashboard based on user needs and feedback."
"Detail the workflow for managing a complex multi-vendor procurement process.","Define procurement requirements and specifications, identify and evaluate potential vendors, request and review proposals or bids, negotiate contracts and terms, select the best-fit vendors based on criteria, coordinate with selected vendors for order placement, manage logistics and delivery schedules, monitor vendor performance and compliance, address any issues or discrepancies, maintain communication and relationships with vendors, and evaluate the procurement process for improvements."
"Describe the steps to implement a robust incident management system in IT operations.","Define incident types and severity levels, select an incident management tool (e.g., ServiceNow, PagerDuty), establish incident response workflows and escalation procedures, assign roles and responsibilities for incident handling, set up automated alerting and notification mechanisms, train the IT team on incident management protocols, conduct regular drills and simulations, document and analyze incidents to identify root causes, implement preventive measures, and continuously improve the incident management process based on lessons learned."
"Outline the workflow for conducting a thorough vendor risk assessment.","Identify and list all current and potential vendors, define risk assessment criteria (e.g., financial stability, security practices, compliance), gather relevant data and documentation from vendors, evaluate vendors against the defined criteria, score and rank vendors based on risk levels, conduct due diligence activities as needed, communicate assessment results to stakeholders, develop mitigation strategies for high-risk vendors, and regularly review and update vendor risk assessments to ensure ongoing risk management."
"Explain the process of setting up a comprehensive employee training and development program.","Assess the training needs through surveys and performance reviews, define training objectives aligned with business goals, design a curriculum covering necessary skills and knowledge, select appropriate training methods (e.g., workshops, e-learning, on-the-job training), schedule training sessions, allocate resources and budget, implement the training program, monitor participation and engagement, evaluate training effectiveness through assessments and feedback, and iterate the program based on evaluation results and evolving training needs."
"Analyze the ethical implications of artificial intelligence in decision-making processes.","The ethical implications include concerns about bias in algorithms, accountability for AI-driven decisions, transparency in how decisions are made, and the potential displacement of jobs. It is crucial to ensure that AI systems are designed and implemented responsibly, with mechanisms for oversight and fairness."
"Develop a comprehensive plan to reduce carbon emissions in a mid-sized city.","The plan should include increasing public transportation options, promoting electric vehicle usage through incentives and infrastructure, implementing energy-efficient building codes, expanding green spaces, encouraging renewable energy adoption, and launching public awareness campaigns on sustainability."
"Explain the relationship between quantum mechanics and general relativity, and why unifying them is challenging.","Quantum mechanics and general relativity are foundational theories in physics describing the very small and the very large, respectively. Unifying them is challenging because their mathematical frameworks are fundamentally different, leading to inconsistencies when trying to describe phenomena where both quantum effects and gravitational effects are significant, such as in black holes or the early universe."
"Propose a strategy for a company to transition from a traditional business model to a digital-first approach.","The strategy should include assessing current digital capabilities, defining clear digital transformation goals, investing in necessary technologies, upskilling employees, fostering a culture of innovation, redesigning business processes for digital integration, enhancing cybersecurity measures, and continuously monitoring and adapting the strategy based on feedback and technological advancements."
"Evaluate the potential economic impacts of implementing a universal basic income in a developed country.","Implementing a universal basic income could stimulate consumer spending, reduce poverty, and provide financial security, potentially leading to increased entrepreneurship. However, it may also result in higher taxes, inflation, reduced labor force participation, and challenges in funding the program sustainably. The overall impact would depend on the specific design and economic context."
"Design a multi-layered security system for a financial institution to protect against cyber threats.","The system should include network security measures such as firewalls and intrusion detection systems, data encryption, multi-factor authentication for user access, regular security audits and vulnerability assessments, employee training programs on cybersecurity best practices, incident response plans, and collaboration with cybersecurity experts to stay updated on emerging threats."
"Analyze the impact of social media on political polarization and propose solutions to mitigate its effects.","Social media can amplify political polarization by creating echo chambers, spreading misinformation, and fostering divisive content. To mitigate its effects, solutions could include promoting media literacy, implementing stricter content moderation policies, encouraging diverse viewpoints, enhancing transparency in algorithms, and fostering constructive online dialogues through platform design changes."
"Create a detailed workflow for developing a machine learning model from data collection to deployment.","The workflow includes: 1) Data Collection: Gather relevant and high-quality data; 2) Data Cleaning: Remove inconsistencies and handle missing values; 3) Exploratory Data Analysis: Understand data patterns and relationships; 4) Feature Engineering: Create meaningful features; 5) Model Selection: Choose appropriate algorithms; 6) Training: Train models on the dataset; 7) Evaluation: Assess model performance using metrics; 8) Hyperparameter Tuning: Optimize model parameters; 9) Validation: Validate model on unseen data; 10) Deployment: Integrate the model into production environments; 11) Monitoring: Continuously monitor model performance and update as needed."
"Discuss the challenges and benefits of implementing blockchain technology in supply chain management.","Challenges include high energy consumption, scalability issues, integration with existing systems, regulatory uncertainties, and the need for standardization. Benefits encompass increased transparency, enhanced traceability of products, reduced fraud, improved efficiency through smart contracts, and greater trust among stakeholders."
"Formulate a hypothesis on the relationship between sleep quality and cognitive performance in adults and outline an experimental design to test it.","Hypothesis: Improved sleep quality positively correlates with enhanced cognitive performance in adults. Experimental Design: Recruit a diverse sample of adults, measure their baseline cognitive performance using standardized tests, assess sleep quality through questionnaires and sleep tracking devices, implement interventions to improve sleep quality for a subset of participants, and compare changes in cognitive performance between the intervention and control groups over time."
"Explain the significance of Gödel's incompleteness theorems in the context of mathematical logic.","Gödel's incompleteness theorems demonstrate that in any consistent formal system capable of expressing basic arithmetic, there are true statements that cannot be proven within the system. This highlights inherent limitations in formal mathematical systems, showing that no single system can be both complete and consistent, and has profound implications for the philosophy of mathematics and our understanding of mathematical truth."
"Design a sustainable urban development plan that balances economic growth, environmental protection, and social equity.","The plan should incorporate mixed-use zoning to reduce commute times, invest in renewable energy and green infrastructure, promote affordable housing and inclusive communities, enhance public transportation, preserve natural areas and biodiversity, implement waste reduction and recycling programs, support local businesses, ensure equitable access to resources and services, and engage community stakeholders in the planning process to ensure diverse needs are met."
"Analyze the role of cultural intelligence in international business negotiations and provide strategies to enhance it.","Cultural intelligence allows individuals to navigate and respect diverse cultural norms, communication styles, and business practices, leading to more effective negotiations. Strategies to enhance it include: engaging in cultural training and education, actively learning about the counterpart's culture, practicing empathy and open-mindedness, adapting communication styles to fit cultural contexts, seeking feedback, and building diverse teams to gain broader perspectives."
"Develop a comprehensive marketing strategy for launching a new eco-friendly product in a competitive market.","The strategy should include: identifying the target audience interested in sustainability, highlighting the product's unique eco-friendly features, leveraging digital marketing channels such as social media and content marketing to educate consumers, forming partnerships with environmental organizations, utilizing influencer marketing, implementing sustainable packaging and branding, offering incentives for early adopters, conducting market research to understand competitors, setting measurable goals, and continuously monitoring and adjusting the strategy based on consumer feedback and market trends."
"Evaluate the potential consequences of artificial general intelligence (AGI) surpassing human intelligence.","Potential consequences include significant advancements in technology and problem-solving capabilities, economic disruptions due to automation, ethical dilemmas regarding autonomy and decision-making, risks of misuse or unintended behaviors, challenges in maintaining control and alignment with human values, and profound societal changes. It is crucial to address these issues through responsible development, robust safety measures, and international cooperation."
