input,output
"Propose a method for assessing the long-term sustainability of a new technology.","The method should include evaluating environmental impact (resource usage, emissions, waste), economic viability (costs, scalability, market demand), social implications (job creation or displacement, accessibility, societal benefits), technological feasibility (reliability, maintenance, integration with existing systems), lifecycle analysis (from production to disposal), regulatory compliance, and potential for innovation and adaptability. It should also involve stakeholder engagement and scenario planning to anticipate future developments."
"Analyze the role of cognitive biases in decision-making and suggest strategies to mitigate their effects.","Cognitive biases, such as confirmation bias, anchoring, and availability heuristic, can distort perception and judgment, leading to flawed decisions. To mitigate their effects, strategies include promoting awareness of common biases, encouraging critical thinking and reflective practices, implementing decision-making frameworks that require evidence-based evaluations, fostering diverse perspectives to challenge assumptions, utilizing checklists and structured processes, and leveraging data and analytics to inform decisions objectively."
"Design a comprehensive plan to enhance digital literacy in underprivileged communities.","The plan should include: providing access to digital devices and reliable internet, offering free or affordable training programs tailored to different skill levels, partnering with local organizations and schools to reach target populations, developing curriculum that covers basic computer skills, internet navigation, online safety, and digital tools for education and employment, recruiting and training instructors from within the community, creating supportive learning environments, ensuring ongoing support and resources, and measuring the program’s impact to make continuous improvements."
"Explain the interplay between supply and demand in determining market prices, using a real-world example.","Supply and demand interact to set market prices based on availability and consumer desire for a product. For instance, during a heatwave, the demand for air conditioners increases. If the supply remains constant, the higher demand leads to higher prices. Conversely, if manufacturers increase production to meet the heightened demand, the increased supply can stabilize or reduce prices, balancing the market."
"Propose a strategy for integrating renewable energy sources into a national power grid to achieve carbon neutrality by 2050.","The strategy should include: setting clear national targets and timelines, investing in renewable energy infrastructure such as solar, wind, hydro, and geothermal, upgrading the power grid for better integration and stability, developing energy storage solutions to manage intermittency, implementing policies and incentives to encourage renewable adoption, promoting research and development in clean technologies, enhancing energy efficiency measures across industries and households, fostering international collaborations for technology transfer, and ensuring a just transition for workers and communities affected by the shift away from fossil fuels."
"Analyze the impact of artificial intelligence on the future of work and propose solutions to address potential challenges.","AI can lead to increased automation, enhancing productivity and creating new job categories, but it may also result in job displacement and require workers to develop new skills. To address these challenges, solutions include investing in education and retraining programs, promoting lifelong learning, implementing policies that support workforce transitions, encouraging the development of AI in ways that complement human workers, ensuring ethical AI deployment, and fostering inclusive economic growth that benefits all sectors of society."
"Design a multi-disciplinary approach to combat antibiotic resistance in healthcare settings.","The approach should involve collaboration between microbiologists, clinicians, pharmacists, epidemiologists, and public health officials. It includes implementing antibiotic stewardship programs to optimize antibiotic use, enhancing infection control measures to prevent the spread of resistant bacteria, investing in research for new antibiotics and alternative treatments, educating healthcare professionals and the public about responsible antibiotic use, monitoring and reporting resistance patterns, regulating the use of antibiotics in agriculture, and developing policies that support sustainable practices to mitigate the rise of antibiotic resistance."
"Explain the principles of thermodynamics and their application in designing energy-efficient systems.","The principles of thermodynamics include the laws that govern energy transfer and transformation. The first law (conservation of energy) ensures that energy is neither created nor destroyed, only transformed. The second law introduces entropy, stating that energy transformations are not completely efficient and some energy is lost as heat. The third law states that as temperature approaches absolute zero, entropy approaches a constant minimum. These principles are applied in designing energy-efficient systems by optimizing energy flows, minimizing waste, improving insulation, and utilizing energy recovery systems to enhance overall efficiency."
"Propose a framework for assessing the economic feasibility of implementing electric vehicle infrastructure in a metropolitan area.","The framework should include: analyzing current and projected electric vehicle adoption rates, estimating the costs of infrastructure development (charging stations, grid upgrades), evaluating potential revenue streams (charging fees, government incentives), assessing the economic benefits (job creation, reduced fuel costs), considering environmental and health cost savings, conducting cost-benefit analyses, exploring financing options, and engaging stakeholders to ensure alignment with transportation and urban planning goals."
"Analyze the role of neural networks in advancing natural language processing and their limitations.","Neural networks, particularly deep learning models like transformers, have significantly advanced natural language processing (NLP) by enabling more accurate language understanding, translation, and generation. They excel at capturing complex patterns and contextual relationships in text. However, their limitations include requiring large amounts of data and computational resources, lack of transparency and interpretability, susceptibility to biases present in training data, challenges in handling ambiguous or nuanced language, and difficulties in reasoning and understanding beyond pattern recognition."
"Design a policy to promote renewable energy adoption among small and medium-sized enterprises (SMEs).","The policy should include financial incentives such as grants, tax credits, and low-interest loans for renewable energy installations, providing technical assistance and resources to help SMEs assess and implement renewable solutions, simplifying regulatory processes and reducing bureaucratic barriers, offering training programs on the benefits and use of renewable energy, creating awareness campaigns to highlight successful SME renewable initiatives, establishing partnerships with renewable energy providers, and monitoring and evaluating the policy's effectiveness to make necessary adjustments."
"Explain the concept of blockchain consensus mechanisms and compare Proof of Work and Proof of Stake.","Blockchain consensus mechanisms are protocols that ensure all participants agree on the network's state. Proof of Work (PoW) requires participants (miners) to solve complex mathematical puzzles to validate transactions and add blocks, ensuring security but consuming significant energy. Proof of Stake (PoS) selects validators based on the number of tokens they hold and are willing to "stake" as collateral, which is more energy-efficient and can offer faster transaction times, but may introduce centralization risks if a few participants hold a large stake."
"Propose a strategy for mitigating the effects of urban heat islands in large cities.","The strategy should include increasing urban green spaces like parks and green roofs, implementing reflective or green building materials, enhancing tree canopy coverage through urban forestry initiatives, promoting cool pavement technologies, improving water features and irrigation systems to provide cooling through evaporation, optimizing urban planning to enhance airflow and reduce heat accumulation, encouraging energy-efficient building designs, and raising public awareness about practices that can help reduce local temperatures."
"Analyze the potential consequences of widespread adoption of autonomous drones for delivery services.","Potential consequences include increased efficiency and faster delivery times, reduced traffic congestion, and lower carbon emissions if drones are electric. However, there are also concerns about privacy invasion, airspace regulation challenges, noise pollution, potential job losses in delivery sectors, security risks such as drone hacking or misuse, and the need for infrastructure to support drone operations. Addressing these consequences requires comprehensive regulations, technological safeguards, and societal discussions on acceptable uses."
"Design a comprehensive cybersecurity training program for employees in a healthcare organization.","The program should include modules on recognizing phishing attempts, safe handling of sensitive patient data, proper use of passwords and authentication methods, understanding and complying with relevant regulations like HIPAA, secure use of devices and networks, protocols for reporting security incidents, regular assessments and updates to training materials, engaging interactive and scenario-based learning, and fostering a culture of security awareness through continuous communication and leadership support."
"Explain the significance of the Heisenberg Uncertainty Principle in quantum physics.","The Heisenberg Uncertainty Principle states that it is impossible to simultaneously know both the exact position and exact momentum of a particle with absolute precision. This principle highlights the fundamental limitations of measurement at the quantum level and implies that particles do not have definite positions and momenta until they are observed. It challenges classical notions of determinism and has profound implications for the behavior of particles in quantum systems."
"Propose a method for evaluating the effectiveness of a public transportation system in reducing urban traffic congestion.","The method should include collecting data on traffic volume and congestion levels before and after public transportation improvements, analyzing ridership statistics to assess usage, conducting surveys to understand commuter preferences and satisfaction, measuring changes in vehicle emissions and environmental impact, evaluating the accessibility and coverage of the public transportation network, and comparing costs versus benefits. Additionally, using traffic simulation models can help predict long-term effects and guide further improvements."
"Analyze the impact of 5G technology on the Internet of Things (IoT) ecosystem.","5G technology enhances the IoT ecosystem by providing faster data speeds, lower latency, and greater connectivity, enabling more devices to communicate simultaneously. This leads to improved performance for applications like smart cities, autonomous vehicles, and industrial automation. However, challenges include the high cost of infrastructure deployment, security vulnerabilities due to increased device connectivity, potential privacy concerns, and the need for standardization and interoperability among diverse IoT devices."
"Design a sustainable waste management system for a university campus.","The system should include comprehensive recycling programs with clearly labeled bins, composting organic waste from cafeterias, implementing waste reduction initiatives like reusable containers and packaging, educating students and staff on proper waste segregation, partnering with local recycling and waste processing facilities, monitoring and analyzing waste generation patterns to identify improvement areas, promoting digital documentation to minimize paper waste, and incorporating circular economy principles to reuse materials whenever possible."
"Explain the concept of supply chain resilience and propose strategies to enhance it.","Supply chain resilience refers to the ability of a supply chain to anticipate, prepare for, respond to, and recover from disruptions. Strategies to enhance it include diversifying suppliers and sourcing locations to reduce dependency, increasing inventory buffers for critical components, investing in supply chain visibility and real-time monitoring systems, developing contingency plans and scenario analyses, fostering strong relationships and communication with suppliers, implementing flexible manufacturing processes, leveraging technology for better demand forecasting, and continuously assessing and improving risk management practices."
"Propose a framework for assessing the societal impact of emerging technologies like artificial intelligence and biotechnology.","The framework should include: identifying key stakeholders and affected groups, evaluating potential benefits (e.g., improved healthcare, increased efficiency), assessing risks and ethical considerations (e.g., privacy, inequality), analyzing economic implications (e.g., job displacement, new industries), considering environmental effects, examining legal and regulatory challenges, incorporating public perception and societal values, utilizing interdisciplinary research methods, and implementing mechanisms for ongoing monitoring and evaluation to ensure responsible development and deployment of technologies."
"Analyze the role of emotional intelligence in leadership effectiveness and team performance.","Emotional intelligence (EI) in leadership involves the ability to recognize, understand, and manage one's own emotions and those of others. High EI leaders can foster a positive work environment, enhance communication, resolve conflicts effectively, and motivate team members. This leads to improved team performance, higher employee satisfaction, increased collaboration, and better adaptability to change. Leaders with strong EI are also better equipped to handle stress and make empathetic decisions, contributing to overall organizational success."
"Design a research study to investigate the effects of mindfulness meditation on stress reduction in college students.","The study should include: defining clear research questions, selecting a representative sample of college students, randomly assigning participants to a mindfulness meditation group and a control group, implementing a structured meditation program for the experimental group, measuring stress levels using validated scales (e.g., Perceived Stress Scale) before and after the intervention, controlling for confounding variables such as prior meditation experience and lifestyle factors, analyzing the data for statistically significant differences, and interpreting the results to determine the effectiveness of mindfulness meditation in reducing stress among college students."
"Explain the concept of circular economy and its importance in sustainable development.","A circular economy is an economic system aimed at eliminating waste and the continual use of resources through principles like designing out waste, keeping products and materials in use, and regenerating natural systems. It contrasts with the traditional linear economy of take-make-dispose. The circular economy is important for sustainable development as it reduces environmental impact, conserves resources, fosters innovation, creates economic opportunities, and promotes resilience against resource scarcity and environmental degradation."
"Propose a multi-step approach to enhance data privacy in a cloud computing environment.","The approach should include: implementing strong encryption for data at rest and in transit, enforcing strict access controls and authentication mechanisms, conducting regular security audits and vulnerability assessments, ensuring compliance with data protection regulations, utilizing data anonymization and masking techniques, establishing robust incident response plans, educating employees on data privacy best practices, deploying secure APIs and interfaces, monitoring and logging data access and usage, and collaborating with trusted cloud service providers who prioritize data privacy and security."
"Analyze the impact of renewable energy adoption on national energy security and economy.","Renewable energy adoption enhances national energy security by reducing dependence on imported fossil fuels, diversifying energy sources, and mitigating supply disruptions caused by geopolitical tensions. Economically, it can create jobs in the renewable sector, stimulate technological innovation, and lead to long-term cost savings through decreased fuel expenses. However, it may require significant upfront investments, infrastructure upgrades, and adjustments in the energy market. Overall, the benefits contribute to a more resilient and sustainable energy landscape."
"Compare the process of photosynthesis in plants to solar panels generating electricity.","Just as plants convert sunlight into chemical energy through photosynthesis, solar panels transform sunlight into electrical energy, both harnessing solar power for useful output."
"Evaluate the argument: 'All swans we have seen are white; therefore, all swans are white.'","This argument is based on limited observation and may be biased; it overlooks the possibility of black swans, highlighting the importance of considering exceptions."
"If all mammals are warm-blooded and whales are mammals, what can we deduce about whales?","We can deduce that whales are warm-blooded."
"Given sudden bird migration patterns, hypothesize why this might be occurring.","The migration could be due to changes in climate affecting food sources, prompting birds to move to new areas."
"Explain how economic policies, consumer behavior, and market trends interact in an economy.","Economic policies influence consumer behavior by altering incentives, which in turn affects market trends; these elements are interdependent within the economic system."
"Reflect on how your problem-solving approach has evolved over time.","By analyzing past strategies and outcomes, I've learned to approach problems more systematically, leading to more effective solutions."
"Draw an analogy between the human brain and a computer's central processing unit.","Like a CPU processes information and executes instructions, the human brain processes stimuli and directs responses."
"Critically assess the statement: 'Technology always improves quality of life.'","While technology can enhance convenience, it may also lead to issues like decreased privacy or increased screen time, so the impact is not universally positive."
"If it rains, the ground gets wet. It is raining now. What conclusion can we draw?","We can deduce that the ground is getting wet."
"Given that a patient presents with symptoms A, B, and C, what is the most probable diagnosis?","Based on the symptoms, the most probable diagnosis is condition X, but further tests are needed to confirm."
"Analyze how changes in one component of an ecosystem affect the entire system.","A decrease in predator populations can lead to an overpopulation of prey species, which may result in vegetation depletion and impact other species."
"Consider how you adjust your learning strategies when encountering difficult material.","I reflect on which methods haven't been effective and adapt by trying new approaches, like visual aids or group study."
"Find similarities between water flowing in pipes and electricity flowing in circuits.","Water flow in pipes is analogous to electrical current in circuits; pressure difference drives water flow, similar to voltage driving current."
"Question the validity of the claim: 'Eating carrots improves night vision.'","Scientific evidence does not strongly support this claim; it's a misconception originating from wartime propaganda."
"From the premises 'All birds lay eggs' and 'A penguin is a bird,' what follows?","We can deduce that a penguin lays eggs."
"Observe that the car won't start and the battery is new; what might be the cause?","Possible causes could include a faulty starter motor or ignition switch; further investigation is needed."
"Explain how urban development can impact local climate conditions.","Urban development can lead to the urban heat island effect, altering temperature and precipitation patterns."
"Think about how you can better manage your time for increased productivity.","By analyzing my current time use and identifying distractions, I can implement strategies like time blocking."
"Relate the structure of an atom to a solar system.","Just as planets orbit the sun, electrons orbit the nucleus in an atom."
"Evaluate the credibility of a news article with anonymous sources.","An article relying on anonymous sources may lack verifiable evidence, so its credibility is questionable without corroboration."
"If all humans are mortal and Socrates is a human, what can we conclude?","We can deduce that Socrates is mortal."
"Given unusual traffic patterns, what might be causing the congestion?","Possible causes could include an accident, road construction, or a special event in the area."
"Discuss how supply and demand dynamics influence market prices.","An increase in demand or a decrease in supply typically raises prices, illustrating their interdependent relationship."
"Reflect on how receiving feedback influences your learning process.","Feedback helps me identify areas for improvement, allowing me to adjust my strategies for better outcomes."
"Compare the heart's function to a pump in a mechanical system.","The heart pumps blood through the body much like a mechanical pump circulates fluids through a system."
"Analyze the logical consistency of the argument: 'If it's hot, ice melts. The ice is melting, so it must be hot.'","This is a logical fallacy called affirming the consequent; ice can melt due to other reasons like exposure to heat sources."
"From the observation of increased sales after advertising, what can we infer?","We can infer that advertising may have positively influenced sales."
"Explain how different departments within a company contribute to its overall success.","Each department, such as marketing, sales, and operations, plays a role that interconnects to drive the company's performance."
"Consider how your biases might affect your interpretation of information.","By recognizing personal biases, I can strive to assess information more objectively."
"Draw parallels between natural selection and competitive business environments.","In both cases, entities that adapt effectively to their environment are more likely to survive and succeed."
"Critically examine the assumption that correlation implies causation.","Correlation does not necessarily mean one event causes another; other factors may be involved."
"If either event A or event B must happen, and event A has occurred, what can we conclude?","We can deduce that event B will not occur."
"Given a patient's symptoms align with multiple conditions, how do you determine the diagnosis?","Using abductive reasoning, we select the most likely condition but may need additional tests to confirm."
"Discuss how policy changes in one country can affect the global economy.","Policy changes can impact trade relations, currency values, and international investments, illustrating systemic interconnectedness."
"Reflect on how monitoring your thought patterns can improve decision-making.","By being aware of cognitive biases, I can make more rational and effective decisions."
"Relate the process of team collaboration to an orchestra performance.","Just as musicians must coordinate and harmonize, team members need to work together cohesively to achieve goals."
"Evaluate the strength of an argument that relies on anecdotal evidence.","Anecdotal evidence is weak as it lacks statistical support and may not represent general trends."
"If all squares are rectangles and all rectangles are quadrilaterals, what can we conclude about squares?","We can deduce that all squares are quadrilaterals."
"Given that a device isn't charging, what are potential reasons?","Possible causes include a faulty charger, a damaged charging port, or battery issues."
"Explain how economic, environmental, and social factors influence sustainability.","These factors interact to determine sustainable practices; neglecting one can undermine overall sustainability."
"Consider how practicing mindfulness affects stress levels.","By being aware of my thoughts and feelings, I can reduce stress through improved emotional regulation."
"Find an analogy to explain how a firewall protects a computer network.","A firewall acts like a security guard, monitoring and controlling incoming and outgoing network traffic."
"Critically analyze the belief that more hours worked equals higher productivity.","Working longer hours can lead to burnout and decreased efficiency, so quality of work may suffer despite increased hours."
"If it's true that 'All that glitters is not gold,' what can we deduce about glittering objects?","We can deduce that some glittering objects are not gold."
"Given incomplete data, how might you estimate the missing values?","Using abductive reasoning, we can make educated guesses based on patterns in the available data."
