input,output
"What is the next number in the sequence: 2, 4, 8, 16, ?", "The next number is 32."
"Reflect on a time you overcame a significant challenge.", "I recall when I had to adapt to a new work environment quickly; through persistence and open-mindedness, I succeeded."
"If all bloops are razzles and all razzles are wozzles, are all bloops wozzles?", "Yes, if all bloops are razzles and all razzles are wozzles, then all bloops are wozzles."
"Explain the moral of the story 'The Tortoise and the Hare'.", "The moral is that slow and steady wins the race; consistent effort can overcome natural talent."
"Analyze the impact of technology on modern communication.", "Technology has revolutionized communication by enabling instant connectivity, but it also poses challenges like reduced face-to-face interactions."
"Is the statement 'This sentence is false' true or false?", "This is a paradox known as the liar paradox; it cannot be classified as simply true or false."
"Describe how you would approach solving a complex problem.", "I would break it down into smaller parts, research each component, and develop a step-by-step plan."
"What can be inferred if all mammals are warm-blooded and all whales are mammals?", "It can be inferred that all whales are warm-blooded."
"Reflect on your personal growth over the past year.", "I've become more self-aware and have improved my communication skills, leading to better relationships."
"If today is Monday, what day will it be in 100 days?", "It will be Wednesday in 100 days."
"Explain the significance of self-reflection in personal development.", "Self-reflection helps identify strengths and weaknesses, guiding personal growth and goal setting."
"How does critical thinking contribute to effective problem-solving?", "It allows for objective analysis, identifying biases, and making informed decisions."
"If I have two apples and you have three apples, how many apples do we have together?", "We have five apples together."
"Interpret the proverb 'A stitch in time saves nine.'", "Addressing problems early prevents them from becoming larger issues."
"Describe a strategy for improving comprehension when reading complex texts.", "One strategy is to summarize each paragraph in your own words to ensure understanding."
"Reflect on the importance of empathy in interpersonal relationships.", "Empathy fosters understanding and trust, strengthening relationships."
"If it takes 5 machines 5 minutes to make 5 widgets, how long would it take 100 machines to make 100 widgets?", "It would take 5 minutes, as each machine makes a widget in 5 minutes."
"Explain the logical fallacy in the statement 'If it's raining, the ground is wet. The ground is wet, so it must be raining.'", "This is the fallacy of affirming the consequent; the wet ground could be due to other reasons."
"How can setting specific goals enhance personal achievement?", "Specific goals provide clear direction and measurable milestones, increasing motivation."
"Reflect on a decision you made that had unexpected consequences.", "Choosing to study abroad challenged me in unforeseen ways but ultimately broadened my perspective."
"If all roses are flowers and some flowers fade quickly, can we conclude that some roses fade quickly?", "Yes, since roses are flowers, if some flowers fade quickly, some roses may also fade quickly."
"Explain how analogies can aid in understanding complex concepts.", "Analogies relate unfamiliar concepts to known ones, making them easier to comprehend."
"How does self-awareness contribute to personal effectiveness?", "Self-awareness allows individuals to recognize their strengths and areas for improvement, enhancing performance."
"Analyze the logical consistency of the argument: 'All birds can fly. Penguins are birds. Therefore, penguins can fly.'", "The argument is invalid because the premise that all birds can fly is false; penguins cannot fly."
"Reflect on how failure can lead to success.", "Failure provides valuable lessons and opportunities for growth, paving the way to future success."
"Describe the role of feedback in personal development.", "Feedback offers insights into performance, helping to identify areas for improvement."
"How does active listening improve communication?", "Active listening ensures understanding, builds rapport, and prevents misunderstandings."
"If a>b and b>c, what is the relationship between a and c?", "It can be concluded that a>c."
"Explain the importance of setting SMART goals.", "SMART goals are Specific, Measurable, Achievable, Relevant, and Time-bound, which enhances goal attainment."
"Reflect on a time when you had to adapt to a significant change.", "When my company restructured, I adapted by learning new systems and workflows."
"How can cognitive biases affect decision-making?", "Cognitive biases can lead to errors in judgment by influencing how information is perceived and interpreted."
"Evaluate the expression: If A = True, B = False, what is A AND B?","A AND B is False."
"Solve for x: If 2x + 3 = 11, what is x?","x equals 4."
"If all M are P and some S are M, what can we conclude about S and P?","Some S are P."
"What is the truth value of the statement: 'If today is Sunday, then 2 + 2 = 4.'","The statement is true because the conclusion is always true."
"Given the set A = {1,2,3} and B = {3,4,5}, what is A ∩ B?","A ∩ B is {3}."
"Solve the logical expression: NOT (A OR B), when A = False, B = True.","The result is False."
"If x > y and y > z, what is the relationship between x and z?","x > z."
"Determine if the argument is valid: If P implies Q, and Q implies R, then P implies R.","The argument is valid by transitivity."
"What is the contrapositive of the statement 'If it rains, then the ground is wet'?","If the ground is not wet, then it is not raining."
"Simplify the Boolean expression: A AND (A OR B).","Simplified expression is A."
"Translate into a logical expression: 'All that glitters is not gold.'","For all x, if x glitters, then x is not gold."
"If f(x) = 2x and g(x) = x + 3, what is f(g(2))?","f(g(2)) equals 10."
"Given that p ↔ q is true, and p is true, what is the truth value of q?","q is true."
"Is the following argument valid? 'All dogs are animals. Some animals are pets. Therefore, some dogs are pets.'","The argument is not necessarily valid."
"Evaluate the logical equivalence: (A AND B) OR (A AND NOT B).","Equivalent to A."
"If the statement 'If I study, then I pass the exam' is true, and I did not pass the exam, what can be concluded?","I did not study."
"Determine the solution set: x^2 - 4 = 0.","x equals 2 or x equals -2."
"What is the inverse of the conditional statement 'If P, then Q'?","If not P, then not Q."
"If 'All swans are white' is false, what does that imply?","There exists at least one swan that is not white."
"Solve for y: If y = 3x + 2 and x = 4.","y equals 14."
"Given that A ⊆ B and B ⊆ C, what is the relationship between A and C?","A ⊆ C."
"Find the truth value: 'If 2 is even, then 5 is odd.'","The statement is true."
"If the premises are 'All A are B' and 'All B are C,' what is the conclusion?","All A are C."
"Simplify the expression: (x^3 * x^2).","Simplified expression is x^5."
"Determine the validity: 'If it is raining, then the ground is wet. The ground is wet. Therefore, it is raining.'","The argument is invalid; this is affirming the consequent."
"Compute the value: If log_base2 (x) = 3, what is x?","x equals 8."
"What is the converse of the statement 'If it is a dog, then it is an animal'?","If it is an animal, then it is a dog."
"Evaluate the function: f(x) = x^2 - 5x + 6 at x = 2.","f(2) equals 0."
"Is the following statement a tautology: A OR NOT A?","Yes, it is a tautology."
"Translate into symbolic form: 'Neither A nor B is true.'","NOT A AND NOT B."
"If p ∨ q is true and p is false, what is the truth value of q?","q is true."
"Determine if the set {1,2,3,4} is closed under addition.","No, because adding elements can produce results outside the set."
"Solve for x: |x - 3| = 5.","x equals 8 or x equals -2."
"What is the logical implication of 'A ⊕ B = True', where ⊕ denotes exclusive OR?","A and B have opposite truth values."
"Given that A ⇒ B is false, what can be said about A and B?","A is true, and B is false."
"Find the intersection of sets: If A = {x | x > 0} and B = {x | x < 5}, what is A ∩ B?","A ∩ B is {x | 0 < x < 5}."
"Express 'At least one' in logical quantifiers.","There exists an x such that..."
"Solve for x: 2^x = 16.","x equals 4."
"Is the argument valid: 'If today is Friday, then I will relax. Today is not Friday. Therefore, I will not relax.'","Invalid; this is denying the antecedent."
"Compute the derivative of f(x) = x^2.","Derivative is f'(x) = 2x."
"What is De Morgan's Law for 'NOT (A AND B)'?","Equivalent to 'NOT A OR NOT B.'"
"Determine the solution: If 3x - 7 = 2x + 5, what is x?","x equals 12."
"Translate to an implication: 'Being hungry implies I will eat.'","If I am hungry, then I will eat."
"Evaluate the logical expression: (A ⇒ B) AND (B ⇒ C) ⇒ (A ⇒ C).","The expression is always true."
"Find the union of sets: A = {1,2}, B = {2,3}.","A ∪ B is {1,2,3}."
"If 'All squares are rectangles' and 'All rectangles have four sides,' what can be concluded?","All squares have four sides."
"Determine the truth value: 'For all x in real numbers, x^2 ≥ 0.'","The statement is true."
"Solve for x: ln(x) = 1.","x equals e."
"What is the biconditional form of 'If and only if P then Q'?","P if and only if Q."
"Express 'No cats are dogs' in symbolic logic.","For all x, if x is a cat, then x is not a dog."
"If f(x) = 1/x, what is f(f(x))?","f(f(x)) equals x."
"Is the statement 'The sum of an even and an odd number is even' true or false?","False; the sum is odd."
"What is the result of the logical operation: True XOR False?","The result is True."
"Determine if the following is a valid syllogism: 'All men are mortal. Socrates is a man. Therefore, Socrates is mortal.'","The syllogism is valid."
"Find the inverse function of f(x) = (x - 2)/3.","Inverse function is f⁻¹(x) = 3x + 2."
"Outline the steps you would take to plan a successful event.","First, define the event's purpose and goals, then create a budget, select a venue, plan the agenda, coordinate with vendors, and promote the event."
"How would you approach learning a new language efficiently?","I would set clear goals, immerse myself in the language, practice daily, use language learning apps, and engage with native speakers."
"Describe your process for setting and achieving a personal goal.","I identify the goal, break it down into actionable steps, set deadlines, track progress, and adjust the plan as needed."
"What strategies would you use to manage a complex project?","I would create a detailed project plan, assign tasks, set timelines, monitor progress, and communicate regularly with the team."
"Explain how you prioritize tasks when faced with multiple deadlines.","I assess the urgency and importance of each task, then prioritize based on deadlines and impact."
"How do you handle unexpected obstacles in a project?","I analyze the obstacle, develop potential solutions, consult with stakeholders if necessary, and implement the best course of action."
"Describe the steps you would take to make a difficult decision.","I gather relevant information, weigh the pros and cons, consider potential outcomes, and make a choice based on rational analysis."
"How would you develop a new skill outside your comfort zone?","I would research the skill, find resources or mentors, set incremental goals, and practice consistently."
"What is your approach to solving a problem you've never encountered before?","I would define the problem, research possible solutions, consult experts if needed, and apply critical thinking to find a resolution."
"Outline a plan to improve your time management skills.","I would track how I currently spend time, identify inefficiencies, set priorities, use scheduling tools, and establish routines."
"How do you ensure effective collaboration within a team?","I promote open communication, define clear roles, encourage participation, and address conflicts promptly."
"Explain how you adapt to changes in a work environment.","I stay flexible, seek to understand the changes, adjust my strategies accordingly, and maintain a positive attitude."
"Describe the method you use to learn from past experiences.","I reflect on what happened, analyze what went well or poorly, and apply those lessons to future situations."
"How would you prepare for a high-stakes presentation?","I would thoroughly research the topic, organize key points, practice extensively, and anticipate audience questions."
"What steps do you take to stay motivated during long-term projects?","I set interim goals, celebrate small achievements, maintain a clear vision of the end goal, and keep track of progress."
"How do you approach setting achievable deadlines?","I estimate the time required for each task, consider potential delays, and set realistic deadlines accordingly."
"Explain how you manage stress during peak workloads.","I prioritize tasks, take short breaks, practice stress-reduction techniques, and maintain a healthy work-life balance."
"Describe your process for delegating tasks effectively.","I assess team members' strengths, assign tasks accordingly, provide clear instructions, and monitor progress."
"How do you handle receiving constructive criticism?","I listen openly, avoid taking it personally, reflect on the feedback, and implement improvements."
"What is your strategy for building professional relationships?","I engage in networking, maintain open communication, offer assistance, and show genuine interest in others."
"Outline how you would create a personal development plan.","I assess my current skills, identify areas for growth, set specific goals, and outline steps to achieve them."
"How would you approach resolving a conflict within your team?","I would address the issue promptly, facilitate open dialogue, seek mutual understanding, and work towards a collaborative solution."
"Describe how you set priorities when everything seems important.","I evaluate tasks based on urgency and impact, consult with stakeholders, and focus on high-priority items first."
"Explain your method for continuous learning in your field.","I stay updated with industry news, attend workshops, take online courses, and engage with professional communities."
"How do you ensure that you meet your performance objectives?","I set clear targets, monitor progress regularly, seek feedback, and adjust my strategies as needed."
"Describe the steps you take to make informed decisions.","I gather relevant data, analyze information critically, consider alternatives, and choose the best option."
"How would you plan a successful team-building activity?","I would identify team needs, set objectives, choose appropriate activities, coordinate logistics, and gather feedback afterward."
"What is your approach to managing resources effectively?","I assess resource requirements, allocate them efficiently, monitor usage, and adjust allocations as necessary."
"Explain how you stay organized with multiple ongoing projects.","I use project management tools, maintain to-do lists, schedule tasks, and regularly review progress."
"Describe how you handle situations where you lack expertise.","I admit my limitations, seek guidance from experts, and take steps to develop the necessary skills."
"How do you maintain focus on long-term goals amidst daily tasks?","I keep the long-term vision in mind, align daily activities with overarching goals, and regularly review progress."
"Outline your strategy for mentoring a new team member.","I would provide orientation, set clear expectations, offer ongoing support, and encourage open communication."
"Explain how you adapt your communication style for different audiences.","I assess the audience's needs, adjust language complexity, use appropriate examples, and ensure clarity."
"Describe your process for evaluating project success.","I compare outcomes against objectives, gather feedback, analyze performance metrics, and identify lessons learned."
"How would you handle a situation where project requirements change suddenly?","I would assess the impact, communicate with stakeholders, adjust the project plan, and reallocate resources."
"Explain how you build resilience in the face of setbacks.","I maintain a positive mindset, learn from failures, stay adaptable, and focus on solutions."
"Describe the steps you take to innovate in your work.","I encourage creative thinking, stay informed about trends, experiment with new ideas, and seek feedback."
"How do you ensure ethical considerations are part of your decision-making?","I adhere to ethical guidelines, consider the consequences of actions, and consult with others when in doubt."
"Outline how you would lead a team through organizational change.","I would communicate the vision, address concerns, provide support, and involve the team in the transition process."
"Explain your approach to setting measurable objectives.","I define specific, quantifiable targets, establish timeframes, and determine criteria for success."
"Describe how you manage expectations with stakeholders.","I set clear communication channels, provide regular updates, and address concerns proactively."
"How would you go about improving a process within your organization?","I would analyze the current process, identify inefficiencies, gather input, and implement improvements."
"Explain how you balance short-term demands with long-term goals.","I prioritize tasks, delegate when possible, and allocate time for strategic planning."
"Describe your method for fostering innovation within a team.","I create an open environment, encourage idea sharing, recognize contributions, and provide resources for experimentation."
"How do you approach risk management in projects?","I identify potential risks, assess their impact, develop mitigation strategies, and monitor them throughout the project."
"Outline the steps you would take to negotiate a successful agreement.","I would prepare thoroughly, understand both parties' interests, communicate clearly, and seek a win-win outcome."
"Explain how you stay accountable for your commitments.","I set realistic promises, track my responsibilities, communicate progress, and address issues promptly."
"Describe how you cultivate a growth mindset in your professional life.","I embrace challenges, persist through obstacles, learn from criticism, and find inspiration in others' success."
"How do you approach setting and enforcing boundaries at work?","I clearly communicate my limits, respect others' boundaries, and maintain professionalism."
"Explain your strategy for continuous improvement.","I regularly assess my performance, seek feedback, set new goals, and invest in learning opportunities."
"Describe how you align your team's goals with the organization's vision.","I communicate the vision, translate it into actionable team objectives, and ensure everyone understands their role."
"Write a function in Python that calculates the factorial of a number.","The function should use recursion to compute the factorial of a given non-negative integer."
"Fix the error in the following code snippet: 'for i in range(5); print(i)'","Replace the semicolon with a colon: 'for i in range(5): print(i)'"
"Specify the algorithm for sorting a list using the bubble sort method.","Repeatedly step through the list, compare adjacent elements, and swap them if they are in the wrong order."
"Implement a binary search algorithm in Java.","Write a function that searches a sorted array by repeatedly dividing the search interval in half."
"Explain why the code 'if (a = 5)' causes an error in C++.","The single '=' is an assignment operator; use '==' for comparison."
"Design a database schema for an e-commerce application.","Create tables for users, products, orders, and include relationships and constraints for data integrity."
"Convert the decimal number 156 to binary.","The binary representation of 156 is 10011100."
"Optimize the following SQL query: 'SELECT * FROM orders WHERE status = 'completed''","Add an index on the 'status' column to improve query performance."
"Describe the steps to handle exceptions in Python.","Use try-except blocks to catch exceptions, and optionally use finally for cleanup actions."
"Implement a singleton pattern in C#.","Ensure a class has only one instance by making the constructor private and providing a static method that returns the instance."
"Find and correct the logical error: 'while(i <= 10) { i = i - 1; }'","Change 'i = i - 1;' to 'i = i + 1;' to increment and prevent an infinite loop."
"Write a regular expression to validate an email address.","The regex should match the pattern: '^[\\w.-]+@[\\w.-]+\\.\\w+$'"
"Explain the difference between deep copy and shallow copy in object cloning.","A deep copy duplicates all objects, while a shallow copy copies references to the original objects."
"Implement a function to check if a string is a palindrome.","The function should compare characters from both ends moving towards the center."
"Identify the error in 'int[] arr = new int(5);' in Java.","Arrays should be initialized with square brackets: 'int[] arr = new int[5];'"
"Design an algorithm to find the greatest common divisor (GCD) of two numbers.","Use the Euclidean algorithm, which involves recursive division."
"Convert the hexadecimal number '1A3F' to decimal.","The decimal equivalent of '1A3F' is 6719."
"Explain how garbage collection works in Java.","The garbage collector automatically frees memory by destroying objects that are no longer reachable."
"Implement a stack data structure using two queues.","Use two queues to simulate stack operations by reversing the order of elements."
"Fix the syntax error: 'console.log('Hello World)'","Add the missing quote: 'console.log('Hello World')'"
"Describe how to perform a merge sort on an array of integers.","Divide the array into halves, sort each half, and merge the sorted halves."
"Write a SQL query to find duplicate records in a table named 'employees'.","Use 'SELECT name, COUNT(*) FROM employees GROUP BY name HAVING COUNT(*) > 1;'"
"Explain the concept of polymorphism in object-oriented programming.","Polymorphism allows objects to be treated as instances of their parent class rather than their actual class."
"Implement a function to reverse a linked list in-place.","Iteratively reverse the pointers of each node until the list is reversed."
"Find the bug in the code: 'if(userInput = 10){ executeTask(); }'","Change '=' to '==' to correctly compare values."
"Design a RESTful API endpoint for retrieving user profiles.","Use an endpoint like '/api/users/{id}' with GET method to return user data."
"Convert the binary number '1101011' to octal.","The octal equivalent is '153'."
"Explain the difference between synchronous and asynchronous programming.","Synchronous programming waits for tasks to complete before moving on, while asynchronous programming allows tasks to run concurrently."
"Implement a queue using two stacks in Python.","Use two stacks to manage enqueue and dequeue operations by reversing order appropriately."
"Fix the off-by-one error in the loop: 'for(int i = 0; i <= n; i++)'","Change '<=' to '<' to prevent accessing an index out of bounds."
"Write a function to calculate the Fibonacci sequence up to n terms.","Use either iteration or recursion to sum the previous two numbers to get the next one."
"Describe how to normalize a database table.","Organize data to reduce redundancy by applying normalization forms like 1NF, 2NF, and 3NF."
"Implement a basic authentication system using JWT.","Generate JSON Web Tokens upon login and validate them for protected routes."
"Explain why 'float f = 1.1;' might cause issues in Java.","Floating-point literals are double by default; use '1.1f' or cast to float."
"Design an algorithm to detect a cycle in a linked list.","Use Floyd's Tortoise and Hare algorithm to detect if pointers meet."
"Convert the number 255 to hexadecimal.","The hexadecimal representation of 255 is 'FF'."
"Identify the security flaw in storing passwords in plain text.","Plain text storage is vulnerable to breaches; use hashing with salts for security."
"Implement error handling in a promise-based function in JavaScript.","Use '.catch()' to handle errors in promise chains."
"Fix the issue in HTML: '<img src='image.jpg' alt='Image>'","Correct the quotation marks: '<img src='image.jpg' alt='Image'>'"
"Explain the purpose of the 'this' keyword in JavaScript.","'this' refers to the object that is executing the current function."
"Write a function to sort a hashmap by its values in Java.","Convert the map to a list of entries, sort the list using a comparator, and collect it back into a linked hashmap."
"Implement a thread-safe singleton in Python.","Use locks or decorators to ensure only one instance is created in multi-threaded scenarios."
"Describe how to prevent SQL injection attacks.","Use prepared statements and parameterized queries to sanitize inputs."
"Find the error in the CSS rule: 'body { font-size: 16pt; background-color #fff; }'","Add a colon after 'background-color': 'background-color: #fff;'"
"Explain the difference between '==' and '===' in JavaScript.","'==' checks for value equality with type coercion, while '===' checks for both value and type equality without coercion."
"Implement a function to perform matrix multiplication.","Multiply corresponding rows and columns, summing the products for each element in the result matrix."
"Convert the octal number '725' to decimal.","The decimal equivalent is 469."
"Fix the logical error: 'if(x > 10 && x < 5){ doSomething(); }'","The condition is impossible; correct the logic to match the desired range."
