input,output
"Design a class diagram for a library management system.","Include classes like Book, Member, Loan, with appropriate attributes and relationships."
"Explain how event bubbling works in the DOM.","Event bubbling is the propagation of events from the target element up through the parent elements."
"Implement caching to optimize repeated API calls.","Store responses in a cache with expiration logic to reuse data without making unnecessary requests."
"Find and fix the error in the JSON: '{ 'name': 'John', 'age': 30, }'","Remove the trailing comma after '30' and use double quotes for keys: '{ \"name\": \"John\", \"age\": 30 }'"
"Describe the workflow for deploying a web application to a production environment.","The workflow includes developing the application, version control with Git, continuous integration using tools like Jenkins, automated testing, containerization with Docker, deploying to cloud services (e.g., AWS, Azure), monitoring with tools like Prometheus, and setting up logging with ELK stack."
"Outline the steps to conduct a market research study.","Start with defining research objectives, designing the research methodology, collecting data through surveys or interviews, analyzing the data, interpreting the results, and presenting findings with actionable insights."
"Explain the process of onboarding a new employee in a large organization.","The process involves sending a welcome package, completing necessary paperwork, setting up IT accounts, providing access to necessary tools, assigning a mentor, conducting orientation sessions, and setting initial performance goals."
"Detail the workflow for handling customer support tickets from receipt to resolution.","Receive ticket via support system, categorize and prioritize based on urgency, assign to appropriate support agent, investigate and troubleshoot the issue, communicate with the customer, resolve the issue, and follow up to ensure satisfaction."
"Describe the steps involved in developing a mobile application from concept to launch.","Begin with ideation and market research, create wireframes and design UI/UX, develop the app using appropriate technologies, conduct testing (unit, integration, user testing), iterate based on feedback, prepare for deployment on app stores, and execute a marketing plan for launch."
"Outline the workflow for conducting a software code review.","Submit the code for review, assign reviewers, review code for functionality, readability, and adherence to standards, provide feedback and suggestions, iterate on code based on feedback, approve the code, and merge it into the main codebase."
"Explain the process of managing a content marketing campaign.","Start with setting campaign goals, researching the target audience, creating a content calendar, producing content (blogs, videos, social media posts), distributing content through appropriate channels, monitoring engagement and performance, analyzing results, and optimizing future campaigns."
"Detail the workflow for implementing a new feature in an existing software product.","Gather feature requirements, design the feature architecture, create user stories, prioritize tasks in the backlog, develop the feature, conduct code reviews, perform testing (unit, integration, user acceptance), deploy the feature to staging, gather user feedback, and release to production."
"Describe the steps to create and maintain a data pipeline for analytics.","Identify data sources, design the pipeline architecture, extract data from sources, transform data into the required format, load data into a data warehouse, ensure data quality and integrity, schedule regular data ingestion, monitor pipeline performance, and iterate based on analytical needs."
"Outline the workflow for conducting a cybersecurity incident response.","Detect and identify the incident, contain the threat to prevent further damage, eradicate the root cause, recover affected systems, analyze the incident to understand vulnerabilities, document the response process, and implement measures to prevent future incidents."
"Explain the process of conducting a financial audit in a corporation.","Plan the audit by understanding the business and risks, gather financial statements and records, perform tests of controls and substantive procedures, analyze findings, compile audit reports, communicate results to stakeholders, and follow up on recommended actions."
"Detail the workflow for managing a remote development team.","Establish communication channels (e.g., Slack, Zoom), define clear roles and responsibilities, set up project management tools (e.g., Jira, Trello), schedule regular check-ins and stand-ups, ensure access to necessary resources, foster team collaboration through virtual meetings, track progress, and address any issues promptly."
"Describe the steps to execute a data migration from legacy systems to a new platform.","Assess existing data and systems, plan the migration strategy, map data fields between old and new systems, clean and transform data, perform test migrations, validate data integrity, execute the full migration, monitor the process, and provide post-migration support."
"Outline the workflow for creating a machine learning model from data collection to deployment.","Collect and preprocess data, perform exploratory data analysis, select appropriate algorithms, train the model, evaluate performance using metrics, tune hyperparameters, validate the model, deploy the model to a production environment, monitor its performance, and iterate as needed."
"Explain the process of managing an Agile sprint in software development.","Start with sprint planning to define goals and select backlog items, hold daily stand-up meetings to track progress, conduct sprint reviews to demonstrate completed work, perform sprint retrospectives to identify improvements, adjust the backlog based on feedback, and repeat the cycle for the next sprint."
"Detail the workflow for setting up a continuous integration/continuous deployment (CI/CD) pipeline.","Choose a CI/CD tool (e.g., Jenkins, GitHub Actions), configure version control integration, set up automated build processes, implement automated testing, define deployment stages (e.g., staging, production), automate deployment scripts, monitor pipeline performance, and continuously improve the pipeline based on feedback."
"Describe the steps to implement a DevOps culture in an organization.","Assess current processes and culture, promote collaboration between development and operations teams, adopt automation tools for CI/CD, implement infrastructure as code, foster a culture of continuous improvement, provide training and resources, establish metrics to measure success, and encourage open communication and feedback."
"Outline the workflow for conducting user acceptance testing (UAT).","Define UAT objectives and criteria, select representative end-users, create test scenarios and cases, set up the testing environment, execute test cases, collect feedback and document issues, analyze results, address any defects or improvements, obtain final approval from stakeholders, and sign off on the product."
"Explain the process of creating a disaster recovery plan for IT systems.","Identify critical systems and data, assess potential risks and impacts, define recovery objectives (RTO and RPO), develop recovery strategies, create detailed recovery procedures, establish communication plans, conduct regular testing and drills, train staff on their roles, and maintain and update the plan regularly."
"Detail the workflow for implementing an enterprise resource planning (ERP) system.","Conduct needs assessment and define objectives, select an appropriate ERP solution, plan the implementation strategy, configure and customize the system, migrate data from existing systems, train users, perform testing, deploy the ERP system, and provide ongoing support and maintenance."
"Describe the steps to conduct a user experience (UX) audit for a website.","Gather and analyze user data and feedback, evaluate the website’s usability, assess design consistency and accessibility, perform heuristic evaluations, conduct user testing sessions, identify pain points and areas for improvement, compile findings into a report, and recommend actionable changes to enhance the user experience."
"Outline the workflow for managing a supply chain from procurement to delivery.","Identify and select suppliers, negotiate contracts, place purchase orders, manage inventory levels, coordinate logistics and transportation, track shipments, handle customs and compliance if international, manage warehousing, ensure timely delivery to customers, and monitor and optimize the supply chain for efficiency."
"Explain the process of implementing a quality assurance (QA) process in software development.","Define quality standards and objectives, develop QA policies and procedures, establish testing protocols (unit, integration, system, acceptance), integrate QA into the development lifecycle, use automated testing tools, conduct regular audits and reviews, train QA personnel, and continuously improve QA practices based on feedback and metrics."
"Detail the workflow for conducting a business process reengineering (BPR) initiative.","Identify and map existing processes, analyze current performance and identify inefficiencies, define new process objectives, design redesigned processes, implement the new processes, monitor performance against objectives, provide training and support, and continuously refine processes based on performance data."
"Describe the steps to create a content management workflow for a publishing team.","Define roles and responsibilities, establish content creation guidelines, set up a content calendar, use a content management system (CMS) to organize and track content, implement an approval and review process, schedule publishing, promote content through various channels, monitor performance metrics, and iterate based on feedback and analytics."
"Outline the workflow for conducting a product lifecycle management (PLM) process.","Initiate product concept and ideation, perform feasibility studies, design and develop the product, conduct testing and validation, launch the product, manage growth and market penetration, handle maintenance and support, plan for end-of-life, and evaluate the overall lifecycle for future improvements."
"Explain the process of setting up a data governance framework in an organization.","Define data governance objectives and scope, establish data ownership and stewardship roles, create data policies and standards, implement data quality management practices, set up data security and privacy measures, develop data lifecycle management procedures, ensure compliance with regulations, and monitor and enforce the governance framework."
"Detail the workflow for executing a digital transformation strategy.","Assess current digital capabilities and identify gaps, define transformation goals aligned with business objectives, develop a strategic roadmap, invest in necessary technologies, train and upskill employees, implement new processes and systems, integrate digital tools across the organization, monitor progress, and adapt the strategy based on outcomes and changing market conditions."
"Describe the steps to manage a cross-functional project effectively.","Define clear project goals and objectives, assemble a diverse team with relevant expertise, establish communication channels, create a detailed project plan with timelines and milestones, assign roles and responsibilities, facilitate collaboration through regular meetings, track progress and address issues promptly, ensure alignment with overall business goals, and conduct post-project evaluations."
"Outline the workflow for implementing a new customer relationship management (CRM) system.","Assess business needs and select a CRM platform, plan the implementation strategy, configure and customize the CRM to fit requirements, migrate existing customer data, integrate the CRM with other systems, train users on the new system, conduct testing to ensure functionality, deploy the CRM, and provide ongoing support and optimization."
"Explain the process of conducting a Lean Six Sigma project to improve a business process.","Define the problem and project scope, measure current process performance, analyze data to identify root causes of inefficiencies, improve the process by addressing root causes, control the improved process to sustain gains, document the process changes, and review project outcomes to ensure continuous improvement."
"Detail the workflow for managing an IT infrastructure upgrade.","Assess current infrastructure and identify upgrade needs, plan the upgrade strategy and timeline, budget for resources and tools, procure necessary hardware and software, schedule downtime if required, implement the upgrade in phases, test the upgraded infrastructure, migrate data and services, monitor performance post-upgrade, and provide support for any issues."
"Describe the steps to develop and execute a marketing automation strategy.","Define marketing goals and objectives, select a marketing automation platform, segment the target audience, create automated workflows for email campaigns, lead nurturing, and customer engagement, integrate with CRM systems, develop personalized content, set up tracking and analytics, launch automation campaigns, and continuously optimize based on performance data."
"Outline the workflow for conducting a feasibility study for a new business venture.","Define the scope and objectives of the study, conduct market research to assess demand, analyze the competitive landscape, evaluate technical and operational requirements, assess financial viability and funding options, identify potential risks and mitigation strategies, compile findings into a report, and make informed decisions based on the study."
"Explain the process of implementing a knowledge management system in an organization.","Identify knowledge needs and objectives, select an appropriate knowledge management platform, organize and categorize existing knowledge assets, migrate and digitize information, set up access controls and permissions, promote knowledge sharing through collaboration tools, train employees on using the system, and continuously update and maintain the knowledge base."
"Detail the workflow for managing an Agile transformation in a traditional organization.","Assess the current organizational culture and readiness for Agile, define the vision and goals for transformation, provide Agile training and resources, form cross-functional Agile teams, implement Agile practices (e.g., Scrum, Kanban), adopt Agile tools for project management, facilitate cultural shifts towards collaboration and flexibility, monitor progress, and iterate the transformation strategy based on feedback."
"Describe the steps to create a comprehensive business continuity plan.","Identify critical business functions and processes, conduct a business impact analysis, assess risks and threats, develop recovery strategies for each critical function, create detailed response and recovery procedures, establish communication plans, train employees on the plan, conduct regular drills and testing, and review and update the plan periodically."
"Outline the workflow for managing a multi-phase construction project.","Initiate the project with feasibility studies and planning, secure necessary permits and approvals, design the project architecture, procure materials and hire contractors, execute construction in phases, monitor progress and ensure quality control, manage budgets and timelines, address any issues or changes, complete final inspections, and hand over the completed project."
"Explain the process of conducting a competitive analysis for a new product launch.","Identify key competitors in the market, analyze their strengths and weaknesses, assess their product offerings and pricing strategies, evaluate their marketing and distribution channels, gather customer feedback on competitors, identify market gaps and opportunities, and use the insights to inform your product positioning and strategy."
"Detail the workflow for implementing an Internet of Things (IoT) solution in a manufacturing plant.","Define the objectives and requirements of the IoT solution, select appropriate sensors and devices, design the network infrastructure, integrate IoT devices with existing systems, develop data collection and processing mechanisms, implement security measures, deploy the IoT solution, monitor and maintain the system, and analyze the collected data for process improvements."
"Describe the steps to manage a large-scale data analytics project.","Define project goals and key questions, gather and preprocess data from multiple sources, perform exploratory data analysis, select and apply appropriate analytical models, validate and test the models, visualize and interpret the results, communicate findings to stakeholders, implement data-driven decisions, and iterate based on feedback and new data."
"Outline the workflow for developing a chatbot for customer service.","Define the chatbot’s purpose and scope, design conversational flows and scripts, select a chatbot platform or framework, integrate with existing customer service systems, train the chatbot using relevant data, test the chatbot for accuracy and usability, deploy the chatbot, monitor interactions and performance, and continuously update the chatbot based on user feedback and evolving needs."
"Explain the process of setting up a multi-channel marketing strategy.","Identify target audience segments, select appropriate marketing channels (e.g., email, social media, SEO, PPC), create tailored content for each channel, synchronize messaging across channels, implement marketing automation tools, track and analyze performance metrics for each channel, adjust strategies based on data insights, and ensure consistent brand presence across all channels."
"Detail the workflow for conducting a user journey mapping exercise.","Define the scope and objectives of the user journey, gather data on user behaviors and interactions, identify key user personas, outline each step of the user’s interaction with the product or service, identify touchpoints and emotions at each stage, analyze pain points and opportunities for improvement, visualize the user journey, and use the insights to enhance user experience and inform design decisions."
"Describe the steps to implement a blockchain solution for supply chain management.","Identify the specific supply chain issues to address, choose an appropriate blockchain platform, design the blockchain architecture, develop smart contracts for transactions, integrate blockchain with existing supply chain systems, onboard stakeholders and provide necessary training, conduct testing and pilot runs, deploy the blockchain solution, and monitor its performance and scalability."
"Outline the workflow for conducting a strategic planning session for a business.","Gather relevant data and insights about the market and internal operations, facilitate a SWOT analysis to identify strengths, weaknesses, opportunities, and threats, define the company’s vision and mission, set strategic objectives and goals, develop action plans and initiatives, allocate resources, establish key performance indicators (KPIs), communicate the strategic plan to the organization, and review and adjust the plan regularly based on progress and changes in the environment."
"Explain the process of implementing a microservices architecture in a software system.","Analyze the existing monolithic system to identify modular components, define service boundaries and interactions, select appropriate technologies and frameworks, develop individual microservices with clear APIs, implement communication protocols (e.g., REST, gRPC), set up containerization and orchestration tools (e.g., Docker, Kubernetes), ensure security and scalability, deploy the microservices, monitor their performance, and manage inter-service dependencies."
"Detail the workflow for executing a cloud migration project.","Assess the current IT infrastructure and identify workloads for migration, choose the appropriate cloud service provider, develop a migration strategy (lift-and-shift, re-architecting, etc.), plan the migration timeline and phases, prepare the environment by setting up necessary cloud resources, execute the migration of applications and data, perform testing and validation, optimize cloud resources for performance and cost, and provide ongoing support and management."
"Describe the steps to create a comprehensive SEO strategy for a website.","Conduct keyword research to identify relevant terms, perform on-page optimization (title tags, meta descriptions, headers), improve site structure and navigation, create high-quality and relevant content, build backlinks from reputable sources, optimize for mobile and ensure fast page load times, implement technical SEO practices (sitemaps, robots.txt, schema markup), monitor SEO performance using analytics tools, and adjust the strategy based on data insights and algorithm updates."
"Outline the workflow for managing an enterprise-wide software upgrade.","Plan the upgrade by assessing current systems and requirements, communicate the upgrade schedule to stakeholders, back up existing data, test the upgrade in a staging environment, address any compatibility issues, execute the upgrade in production, monitor system performance post-upgrade, provide training and support to users, and document the upgrade process for future reference."
"Explain the process of developing a strategic partnership between two companies.","Identify potential partners that align with your business goals, initiate contact and establish communication, discuss mutual benefits and objectives, negotiate partnership terms and agreements, define roles and responsibilities, develop a joint action plan, implement collaborative initiatives, monitor the partnership’s progress, address any challenges, and evaluate the partnership’s impact on business objectives."
"Detail the workflow for creating an e-learning platform from scratch.","Define the platform’s goals and target audience, design the user interface and user experience, develop the backend infrastructure, create or integrate content management systems, implement features like user registration, course enrollment, progress tracking, and assessments, ensure mobile compatibility, conduct thorough testing, launch the platform, and continuously update content and features based on user feedback."
"Describe the steps to manage a content localization project for international markets.","Identify target languages and regions, select qualified translators and localization experts, prepare source content for translation, translate and adapt content to fit cultural nuances, review and proofread localized content, integrate localized content into the product or marketing materials, conduct quality assurance testing, deploy the localized content, and gather feedback to ensure effectiveness and accuracy."
"Outline the workflow for implementing an artificial intelligence (AI) solution in healthcare.","Identify specific healthcare challenges to address with AI, collect and preprocess relevant medical data, select appropriate AI models and algorithms, train the models using the data, validate and test the models for accuracy and reliability, integrate AI solutions with existing healthcare systems, ensure compliance with healthcare regulations and data privacy, deploy the AI solution in clinical settings, monitor performance and outcomes, and iterate based on feedback and advancements in AI technology."
"Explain the process of conducting a thorough risk assessment for a new project.","Identify potential risks by brainstorming and researching similar projects, categorize risks by type and impact, analyze the likelihood and severity of each risk, prioritize risks based on their potential effect on the project, develop mitigation strategies for high-priority risks, assign responsibilities for managing each risk, monitor risks throughout the project lifecycle, and update the risk assessment as new risks emerge or existing risks change."
"Detail the workflow for managing an international expansion strategy for a business.","Conduct market research to identify viable international markets, analyze local regulations and cultural factors, develop a market entry strategy (e.g., joint ventures, subsidiaries), adapt products or services to meet local needs, establish supply chain and distribution channels, hire and train local staff, implement marketing campaigns tailored to the new market, set up local operations, monitor performance, and adjust strategies based on market feedback and performance metrics."
"Describe the steps to create a robust testing framework for a software application.","Define testing objectives and scope, select appropriate testing methodologies (unit, integration, system, acceptance), choose testing tools and frameworks, develop test cases and scripts based on requirements, set up automated testing where possible, execute tests and log results, identify and document defects, perform regression testing after fixes, ensure coverage of all functional and non-functional requirements, and continuously update the testing framework to accommodate new features and changes."
